character-simplified|pinyin|definition
得罪|dézùi|to commit an offense; to violate the law; excuse me! (formal); see also 得罪[de2 zui5]; to offend sb; to make a faux pas; a faux pas; see also 得罪[de2 zui4]
蹬|dèng|to step on; to tread on; to wear (shoes); (slang) to dump (sb); Taiwan pr. [deng4]
灯笼|dēnglóng|lantern
登陆|dēnglù|to land; to come ashore; to make landfall (of typhoon etc); to log in (frequently used erroneous variant of 登錄/登录[deng1 lu4])
登录|dēnglù|to register; to log in
等级|děngjí|grade; rank; status
瞪|dèng|to open (one's eyes) wide; to stare at; to glare at
堤坝|dībà|dam; dike
敌视|díshì|hostile; malevolence; antagonism; to view as enemy; to stand against
抵达|dǐdá|to arrive; to reach (a destination)
抵抗|dǐkàng|to resist; resistance
抵制|dǐzhì|to resist; to boycott; to refuse (to cooperate); to reject; resistance; refusal
递增|dìzēng|to increase by degrees; in increasing order; incremental; progressive
地步|dìbù|stage; degree (to which a situation has evolved); situation; leeway
地势|dìshì|terrain; topography relief
地质|dìzhí|geology
颠簸|diānbò|to shake; to jolt; to bump
颠倒|diāndǎo|to turn upside down; to reverse; back to front; confused; deranged; crazy
点缀|diǎnzhùi|to decorate; to adorn; sprinkled; studded; only for show
典礼|diǎnlǐ|celebration; ceremony
典型|diǎnxíng|model; typical case; archetype; typical; representative
垫|diàn|pad; cushion; mat; to pad out; to fill a gap; to pay for sb; to advance (money)
电源|diànyuán|electric power source
奠定|diàndìng|to establish; to fix; to settle
惦记|diànjì|to think of; to keep thinking about; to be concerned about
叼|diāo|to hold with one's mouth (as a smoker with a cigarette or a dog with a bone)
雕刻|diāokè|to carve; to engrave; carving
雕塑|diāosù|a statue; a Buddhist image; sculpture; to carve
吊|diào|to suspend; to hang up; to hang a person; a string of 100 cash (arch.); to lament; to condole with; variant of 吊[diao4]
调动|diàodòng|to transfer; to maneuver (troops etc); movement of personnel; to mobilize; to bring into play
跌|diē|to fall; to tumble; to trip; (of prices etc) to drop; Taiwan pr. [die2]
盯|dīng|to watch attentively; to fix one's attention on; to stare at; to gaze at
叮嘱|dīngzhǔ|to warn repeatedly; to urge; to exhort again and again
定期|dìngqī|at set dates; at regular intervals; periodic; limited to a fixed period of time; fixed term
定义|dìngyì|definition; to define
丢人|dīurén|to lose face
丢三落四|dīusānluòsì|forgetful; empty-headed
东道主|dōngdàozhǔ|host; official host (e.g. venue for games or a conference)
东张西望|dōngzhāngxīwàng|to look in all directions (idiom); to glance around
董事长|dǒngshìcháng|chairman of the board; chairman
栋|dòng|classifier for houses or buildings; ridgepole (old)
冻结|dòngjié|to freeze (water etc); (fig.) to freeze (assets, prices etc)
洞穴|dòngxué|cave; cavern
动荡|dòngdàng|variant of 動蕩/动荡[dong4 dang4]; unrest (social or political); turmoil; upheaval; commotion
动机|dòngjī|motor; locomotive; motive; motivation; intention
动静|dòngjìng|(detectable) movement; (sign of) activity; movement and stillness
动力|dònglì|motive power; force; (fig.) motivation; impetus
动脉|dòngmài|artery
动身|dòngshēn|to go on a journey; to leave
动手|dòngshǒu|to set about (a task); to hit; to punch; to touch
动态|dòngtài|movement; motion; development; trend; dynamic (science)
动员|dòngyuán|to mobilize; to arouse; mobilization; CL:次[ci4],個/个[ge4]
兜|dōu|pocket; bag; to wrap up or hold in a bag; to move in a circle; to canvas or solicit; to take responsibility for; to disclose in detail; combat armor (old); old variant of 兜[dou1]
陡峭|dǒuqiào|precipitous
斗争|dǒuzhēng|a struggle; fight; battle
督促|dūcù|to supervise and urge completion of a task; to urge on
都市|dūshì|city; metropolis
独裁|dúcái|dictatorship
毒品|dúpǐn|drugs; narcotics; poison
赌博|dǔbó|to gamble
堵塞|dǔsāi|to clog up; blockage
杜绝|dùjué|to put an end to
端|duān|end; extremity; item; port; to hold sth level with both hands; to carry; regular; old variant of 端[duan1]; start; origin
端午节|duānwǔjié|Dragon Boat Festival (5th day of the 5th lunar month)
端正|duānzhèng|upright; regular; proper; correct
短促|duǎncù|short in time; fleeting; brief; gasping (breath); curt (tone of voice)
断定|duàndìng|to conclude; to determine; to come to a judgment
断断续续|duànduànxùxù|intermittent; off and on; discontinuous; stop-go; stammering; disjointed; inarticulate
断绝|duànjué|to sever; to break off
堆积|dūijī|to pile up; to heap; accumulation
对策|dùicè|countermeasure for dealing with a situation
对称|dùichēng|symmetry; symmetrical
对付|dùifù|to handle; to deal with; to cope; to get by with
对抗|dùikàng|to withstand; to resist; to stand off; antagonism; confrontation
对立|dùilì|to oppose; to set sth against; to be antagonistic to; antithetical; relative opposite; opposing; diametrical
对联|dùilián|rhyming couplet; pair of lines of verse written vertically down the sides of a doorway; CL:副[fu4],幅[fu2]
对应|dùiyìng|to correspond; a correspondence; corresponding; homologous; matching with sth; counterpart
对照|dùizhào|to contrast; to compare; to place side by side for comparison (as parallel texts); to check
兑换|dùihuàn|to convert; to exchange
兑现|dùixiàn|(of a check etc) to cash; to honor a commitment
队伍|dùiwǔ|ranks; troops; queue; line; procession; CL:個/个[ge4],支[zhi1],條/条[tiao2]
顿时|dùnshí|immediately; suddenly
多元化|duōyuánhuà|diversification; pluralism; to diversify
哆嗦|duōsuō|to tremble; to shiver; uncontrolled shaking of the body
堕落|duòluò|to degrade; to degenerate; to become depraved; corrupt; a fall from grace
额外|éwài|extra; added; additional
恶心|èxīn|variant of 惡心/恶心[e3 xin1]; nausea; to feel sick; disgust; nauseating; to embarrass (deliberately); bad habit; vicious habit; vice
恶化|èhuà|to worsen
遏制|èzhì|to check; to contain; to hold back; to keep within limits; to constrain; to restrain
恩怨|ēnyuàn|gratitude and grudges; resentment; grudges; grievances
而已|éryǐ|that's all; nothing more
耳环|ěrhuán|earring; CL:隻/只[zhi1],對/对[dui4]
二氧化碳|èryǎnghuàtàn|carbon dioxide CO2
发布|fābù|to release; to issue; to announce; to distribute; also written 發布/发布[fa1 bu4]; to release; to issue; to announce; to distribute
发财|fācái|to get rich
发呆|fādāi|to stare blankly; to be stunned; to be lost in thought
发动|fādòng|to start; to launch; to unleash; to mobilize; to arouse
发火|fāhuǒ|to catch fire; to ignite; to detonate; to get angry
发觉|fājué|to become aware; to detect; to realize; to perceive
发射|fāshè|to shoot (a projectile); to fire (a rocket); to launch; to emit (a particle); to discharge; emanation; emission
发誓|fāshì|to vow; to pledge; to swear
发行|fāxíng|to publish; to issue (stocks, currency etc); to release; to distribute (a film)
发炎|fāyán|to become inflamed; inflammation
发扬|fāyáng|to develop; to make full use of
发育|fāyù|to develop; to mature; growth; development; (sexually) mature
法人|fǎrén|legal person; corporation; see also 自然人[zi4 ran2 ren2]
番|fān|surname Pan; foreign (non-Chinese); barbarian; classifier for occurrences (of an event, action or speech utterance); classifier for iterations: times, -fold (as in twofold etc); classifier for situations: kind, sort
繁华|fánhuá|flourishing; bustling
繁忙|fánmáng|busy; bustling
繁体字|fántǐzì|traditional Chinese character
繁殖|fánzhí|to breed; to reproduce; to propagate
反驳|fǎnbó|to retort; to refute
反常|fǎncháng|unusual; abnormal
反倒|fǎndǎo|but on the contrary; but expectedly
反动|fǎndòng|reaction; reactionary
反感|fǎngǎn|to be disgusted with; to dislike; bad reaction; antipathy
反抗|fǎnkàng|to resist; to rebel
反馈|fǎnkùi|to send back information; feedback
反面|fǎnmiàn|reverse side; backside; the other side (of a problem etc); negative; bad
反射|fǎnshè|to reflect; reflection (from a mirror etc); reflex (i.e. automatic reaction of organism)
反思|fǎnsī|to think back over sth; to review; to revisit; to rethink; reflection; reassessment
反问|fǎnwèn|to ask (a question) in reply; to answer a question with a question; rhetorical question
反之|fǎnzhī|on the other hand...; conversely...
范畴|fànchóu|category
泛滥|fànlàn|to be in flood; to overflow (the banks); to inundate; to spread unchecked
贩卖|fànmài|to sell; to peddle; to traffic
方位|fāngwèi|direction; points of the compass; bearing; position; azimuth
方言|fāngyán|the first Chinese dialect dictionary, edited by Yang Xiong 揚雄/扬雄[Yang2 Xiong2] in 1st century, containing over 9000 characters; topolect; dialect
方针|fāngzhēn|policy; guidelines; CL:個/个[ge4]
防守|fángshǒu|to defend; to protect (against)
防疫|fángyì|disease prevention; protection against epidemic
防御|fángyù|defense; to defend
防止|fángzhǐ|to prevent; to guard against; to take precautions
防治|fángzhì|to prevent and cure; prevention and cure
纺织|fǎngzhī|spinning and weaving
放大|fàngdà|to enlarge; to magnify
放射|fàngshè|to radiate; radioactive
放手|fàngshǒu|to let go one's hold; to give up; to have a free hand
非法|fēifǎ|illegal
飞禽走兽|fēiqínzǒushòu|birds and animals; the beasts of the field and the birds of the air
飞翔|fēixiáng|to circle in the air; to soar
飞跃|fēiyuè|to leap
肥沃|féiwò|fertile
诽谤|fěibàng|to slander; to libel
匪徒|fěitú|gangster; bandit
废除|fèichú|to abolish; to abrogate; to repeal
废墟|fèixū|ruins
沸腾|fèiténg|(of a liquid) to boil; (of sentiments etc) to boil over; to flare up; to be impassioned
分辨|fēnbiàn|to distinguish; to differentiate; to resolve
分寸|fēncùn|propriety; appropriate behavior; proper speech or action; within the norms
分红|fēnhóng|dividend; to award a bonus
分解|fēnjiě|to resolve; to decompose; to break down
分裂|fēnliè|to split up; to divide; to break up; fission; schism
分泌|fēnmì|to secrete; secretion
分明|fēnmíng|clear; distinct; evidently; clearly
分歧|fēnqí|divergent; difference (of opinion, position); disagreement; bifurcation (math.)
分散|fēnsàn|to scatter; to disperse; to distribute
分手|fēnshǒu|to part company; to split up; to break up
吩咐|fēnfù|to tell; to instruct; to command
坟墓|fénmù|grave; tomb
粉末|fěnmò|fine powder; dust
粉色|fěnsè|pink; white; erotic; beautiful woman; powdered (with make-up)
粉碎|fěnsùi|to crush; to smash; to shatter
分量|fēnliàng|(vector) component; quantity; weight; measure
风暴|fēngbào|storm; violent commotion; fig. crisis (e.g. revolution, uprising, financial crisis etc)
风度|fēngdù|elegance (for men); elegant demeanor; grace; poise
风光|fēngguāng|scene; view; sight; landscape; to be well-regarded; to be well-off; grand (dialect); impressive (dialect)
风气|fēngqì|general mood; atmosphere; common practice
风趣|fēngqù|charm; humor; wit; humorous; witty
风土人情|fēngtǔrénqíng|local conditions and customs (idiom)
风味|fēngwèi|distinctive flavor; distinctive style
封闭|fēngbì|to seal; to close; to confine; to seal off; to close down; sealed; confined; closed; unreceptive
封建|fēngjiàn|system of enfeoffment; feudalism; feudal; feudalistic
封锁|fēngsuǒ|to blockade; to seal off
丰满|fēngmǎn|Fengman district of Jilin city 吉林市, Jilin province; ample; well developed; fully rounded
丰盛|fēngshèng|rich; sumptuous
丰收|fēngshōu|bumper harvest
锋利|fēnglì|sharp (e.g. knife blade); incisive; to the point
逢|féng|to meet by chance; to come across; (of a calendar event) to come along; (of an event) to fall on (a particular day); to fawn upon
奉献|fèngxiàn|to offer respectfully; to consecrate; to dedicate; to devote
否决|fǒujué|to veto; to overrule
夫妇|fūfù|a (married) couple; husband and wife; CL:對/对[dui4]
夫人|fūrén|lady; madam; Mrs.; CL:位[wei4]
敷衍|fūyǎn|to elaborate (on a theme); to expound (the classics); perfunctory; to skimp; to botch; to do sth half-heartedly or just for show; barely enough to get by
幅度|fúdù|width; extent; range; scope
服气|fúqì|to be convinced; to accept
符号|fúhào|symbol; mark; sign
福利|fúlì|material benefit; benefit in kind; (social) welfare
福气|fúqì|good fortune; a blessing
俘虏|fúlǔ|captive
辐射|fúshè|radiation
腐败|fǔbài|corruption; to corrupt; to rot; rotten
腐烂|fǔlàn|to rot; to putrefy; (fig.) corrupt
腐蚀|fǔshí|corrosion; to corrode (degrade chemically); to rot; corruption
腐朽|fǔxǐu|rotten; decayed; decadent; degenerate
辅助|fǔzhù|to assist; to aid; supplementary; auxiliary; subsidiary
抚养|fǔyǎng|to foster; to bring up; to raise
俯仰|fǔyǎng|lowering and raising of the head; (fig.) small move; pitch (position angle)
富裕|fùyù|Fuyu county in Qiqihar 齊齊哈爾/齐齐哈尔[Qi2 qi2 ha1 er3], Heilongjiang; prosperous; well-to-do; well-off
副|fù|secondary; auxiliary; deputy; assistant; vice-; abbr. for 副詞/副词 adverb; classifier for pairs, sets of things & facial expressions
副作用|fùzuòyòng|side effect
负担|fùdàn|burden; to bear a burden
覆盖|fùgài|to cover
附和|fùhé|to agree; to go along with; to echo (what sb says)
附件|fùjiàn|enclosure; attachment (email); appendix
附属|fùshǔ|subsidiary; auxiliary; attached; affiliated; subordinate; subordinating
复活|fùhuó|to revive; (lit. and fig.) to come back to life; (religion) resurrection
复兴|fùxīng|Fuxing district of Handan city 邯鄲市/邯郸市[Han2 dan1 shi4], Hebei; Fuxing or Fuhsing township in Taoyuan county 桃園縣/桃园县[Tao2 yuan2 xian4], north Taiwan; to revive; to rejuvenate
腹泻|fùxiè|diarrhea; to have the runs
赋予|fùyú|to assign; to entrust (a task); to give; to bestow
改良|gǎiliáng|to improve (sth); to reform (a system)
盖章|gàizhāng|to affix a seal; to stamp (a document); to sign off on sth
干旱|gānhàn|drought; arid; dry
干扰|gānrǎo|to disturb; to interfere; perturbation; interference (physics)
干涉|gānshè|to interfere; to meddle; interference
干预|gānyù|to meddle; to intervene; intervention
尴尬|gāngà|awkward; embarrassed
甘心|gānxīn|to be willing to; to resign oneself to
感慨|gǎnkǎi|to sigh with sorrow, regret etc; rueful; deeply moved
感染|gǎnrǎn|infection; to infect; to influence
干劲|gānjìng|enthusiasm for doing sth
纲领|gānglǐng|program (i.e. plan of action); guiding principle
港口|gǎngkǒu|port; harbor
港湾|gǎngwān|natural harbor; bay serving as harbor
岗位|gǎngwèi|a post; a job
杠杆|gānggān|lever; pry bar; crowbar; financial leverage
高超|gāochāo|excellent; superlative
高潮|gāocháo|high tide; high water; upsurge; climax; orgasm; chorus (part of a song)
高峰|gāofēng|peak; summit; height
高考|gāokǎo|college entrance exam (especially as abbr. for 普通高等學校招生全國統一考試/普通高等学校招生全国统一考试[Pu3 tong1 Gao1 deng3 Xue2 xiao4 Zhao1 sheng1 Quan2 guo2 Tong3 yi1 Kao3 shi4]); (Tw) entrance exam for senior government service posts (abbr. for 公務人員高等考試/公务人员高等考试)
高明|gāomíng|Gaoming district of Foshan city 佛山市[Fo2 shan1 shi4], Guangdong; brilliant; superior; tall and bright
高尚|gāoshàng|noble; lofty; refined; exquisite
高涨|gāozhǎng|to surge up; to rise; (of tensions etc) to run high
稿件|gǎojiàn|piece of writing submitted for publication; manuscript; article
告辞|gàocí|to say goodbye; to take one's leave
告诫|gàojiè|to warn; to admonish
割|gē|to cut; to cut apart
搁|gē|to place; to put aside; to shelve; to bear; to stand; to endure
疙瘩|gēda|swelling or lump on skin; pimple; knot; preoccupation; problem
歌颂|gēsòng|to sing the praises of; to extol; to eulogize
隔阂|géhé|misunderstanding; estrangement; (language etc) barrier
隔离|gélí|to separate; to isolate
格局|géjú|structure; pattern; layout
格式|géshì|form; specification; format
个体|gètǐ|individual
各抒己见|gèshūjǐjiàn|everyone gives their own view
根深蒂固|gēnshēndìgù|deep-rooted (problem etc)
根源|gēnyuán|origin; root (cause)
跟前|gēnqián|the front (of); (in) front; (in) sb's presence; just before (a date); (of children, parents etc) at one's side; living with one
跟随|gēnsúi|to follow
跟踪|gēnzōng|to follow sb's tracks; to tail; to shadow; tracking
耕地|gēngdì|arable land; to plow land
更新|gèngxīn|to replace the old with new; to renew; to renovate; to upgrade; to update; to regenerate
更正|gèngzhèng|to correct; to make a correction
公安局|gōngānjú|public security bureau (government office similar in function to a police station)
公道|gōngdào|justice; fairness; public highway; fair; equitable
公告|gōnggào|post; announcement
公关|gōngguān|public relations
公民|gōngmín|citizen
公婆|gōngpó|husband's parents; parents-in-law
公然|gōngrán|openly; publicly; undisguised
公认|gōngrèn|publicly known (to be); accepted (as)
公式|gōngshì|formula
公务|gōngwù|official business
公正|gōngzhèng|just; fair; equitable
公证|gōngzhèng|notarization; notarized; acknowledgement
供不应求|gōngbùyìngqíu|supply does not meet demand
供给|gōnggěi|to furnish; to provide; supply (as in supply and demand)
工夫|gōngfū|(old) laborer; period of time (may be months, or mere seconds); spare time; skill; labor; effort
工艺品|gōngyìpǐn|handicraft article; handiwork; CL:個/个[ge4]
宫殿|gōngdiàn|palace; CL:座[zuo4]
功课|gōngkè|homework; assignment; task; classwork; lesson; study; CL:門/门[men2]
功劳|gōngláo|contribution; meritorious service; credit
功效|gōngxiào|efficacy
攻击|gōngjí|to attack; to accuse; to charge; an attack (terrorist or military)
攻克|gōngkè|to capture; to take; to overcome; to solve
恭敬|gōngjìng|deferential; respectful
巩固|gǒnggù|to consolidate; consolidation; to strengthen
共和国|gònghéguó|republic
共计|gòngjì|to sum up to; to total
共鸣|gòngmíng|resonance (physics); sympathetic response to sth
勾结|gōujié|to collude with; to collaborate with; to gang up with
钩子|gōuzǐ|hook
构思|gōusī|to design; to plot; to plan out; to compose; to draw a mental sketch; conception; plan; idea; composition
孤独|gūdú|lonely; solitary
孤立|gūlì|isolate; isolated
辜负|gūfù|to fail to live up (to expectations); unworthy (of trust); to let down; to betray (hopes); to disappoint
姑且|gūqiě|for the time being; tentatively
古董|gǔdǒng|curio; antique
古怪|gǔguài|eccentric; grotesque; oddly; queer
股东|gǔdōng|shareholder; stockholder
股份|gǔfèn|a share (in a company); stock
鼓动|gǔdòng|to agitate; to arouse; to instigate; to encite
骨干|gǔgān|diaphysis (long segment of a bone); fig. backbone
固然|gùrán|admittedly (it's true that...)
固有|gùyǒu|intrinsic to sth; inherent; native
固执|gùzhí|obstinate; stubborn
顾虑|gùlv̀|misgivings; apprehensions
顾问|gùwèn|adviser; consultant
故乡|gùxiāng|home; homeland; native place; CL:個/个[ge4]
故障|gùzhàng|malfunction; breakdown; defect; shortcoming; fault; failure; impediment; error; bug (in software)
拐杖|guǎizhàng|crutches; crutch; walking stick
关照|guānzhào|to take care; to keep an eye on; to look after; to tell; to remind
官方|guānfāng|government; official (approved or issued by an authority)
观光|guānguāng|to tour; sightseeing; tourism
管辖|guǎnxiá|to administer; to have jurisdiction (over)
罐|guàn|can; jar; pot; variant of 罐[guan4]
贯彻|guànchè|to implement; to put into practice; to carry out
灌溉|guàngài|to irrigate
惯例|guànlì|convention; usual practice
光彩|guāngcǎi|luster; splendor; radiance; brilliance
光辉|guānghūi|radiance; glory; brilliant; magnificent
光芒|guāngmáng|rays of light; brilliant rays; radiance
广阔|guǎngkuò|wide; vast
规范|gūifàn|norm; standard; specification; regulation; rule; within the rules; to fix rules; to regulate; to specify
规格|gūigé|standard; norm; specification
规划|gūihuá|to plan (how to do sth); planning; plan; program
规章|gūizhāng|rule; regulation
归根到底|gūigēndàodǐ|after all; in the final analysis; ultimately
归还|gūihuán|to return sth; to revert
归纳|gūinà|to sum up; to summarize; to conclude from facts; induction (method of deduction in logic)
轨道|gǔidào|orbit; railway or tram line; fig. conventional way of thinking
跪|gùi|to kneel
贵族|gùizú|lord; nobility; nobleman; noblewoman; aristocrat; aristocracy
棍棒|gùnbàng|club; staff; stick
国防|guófáng|national defense
国务院|guówùyuàn|State Council (PRC); State Department (USA)
果断|guǒduàn|firm; decisive
过度|guòdù|excessive; over-; excess; going too far; extravagant; intemperate; overdue
过渡|guòdù|to cross over (by ferry); transition; interim; caretaker (administration)
过奖|guòjiǎng|to overpraise; to flatter
过滤|guòlv̀|to filter; filter
过失|guòshī|error; fault; (law) negligence; delinquency
过问|guòwèn|to show an interest in; to get involved with
过瘾|guòyǐn|to satisfy a craving; to get a kick out of sth; gratifying; immensely enjoyable; satisfying; fulfilling
过于|guòyú|too much; excessively
嗨|hāi|oh alas; hey!; hi! (loanword); a high (natural or drug-induced) (loanword)
海拔|hǎibá|height above sea level; elevation
海滨|hǎibīn|shore; seaside
含糊|hánhú|ambiguous; vague; careless; perfunctory
含义|hányì|meaning (implicit in a phrase); implied meaning; hidden meaning; hint; connotation
寒暄|hánxuān|to exchange conventional greetings; to talk about the weather
罕见|hǎnjiàn|rare; rarely seen
捍卫|hànwèi|to defend; to uphold; to safeguard
航空|hángkōng|aviation
航天|hángtiān|space flight
航行|hángxíng|to sail; to fly; to navigate
行列|xíngliè|ranks; procession
豪迈|háomài|bold; open-minded; heroic
毫米|háomǐ|millimeter
毫无|háowú|not in the least; to completely lack
号召|hàozhào|to call; to appeal
耗费|hàofèi|to waste; to spend; to consume; to squander
好客|hǎokè|hospitality; to treat guests well; to enjoy having guests; hospitable; friendly
呵|hē|variant of 啊[a1]; expel breath; my goodness
和蔼|héǎi|kindly; nice; amiable
和解|héjiě|to settle (a dispute out of court); to reconcile; settlement; conciliation; to become reconciled
和睦|hémù|peaceful relations; harmonious
和气|héqì|friendly; polite; amiable
和谐|héxié|harmonious; harmony; (euphemism) to censor
合并|hébìng|variant of 合併/合并[he2 bing4]; to merge; to annex
合成|héchéng|to compose; to constitute; compound; synthesis; mixture; synthetic
合乎|héhū|to accord with; conforming to
合伙|héhuǒ|to act jointly; to form a partnership
合身|héshēn|well-fitting (of clothes)
合算|hésuàn|worthwhile; to be a good deal; to be a bargain; to reckon up; to calculate
嘿|hēi|hey
痕迹|hénjī|vestige; mark; trace
狠心|hěnxīn|callous; heartless
恨不得|hènbùdé|wishing one could do sth; to hate to be unable; itching to do sth
哼|hēng|to groan; to snort; to hum; to croon; humph!
哄|hōng|roar of laughter (onom.); hubbub; to roar (as a crowd); to deceive; to coax; to amuse (a child); variant of 鬨/哄[hong4]; tumult; uproar; commotion; disturbance
烘|hōng|to bake; to heat by fire; to set off by contrast
轰动|hōngdòng|to cause a sensation; to create a stir in (a place); commotion; controversy
红包|hóngbāo|money wrapped in red as a gift; bonus payment; kickback; bribe
宏观|hóngguān|macro-; macroscopic; holistic
宏伟|hóngwěi|grand; imposing; magnificent
洪水|hóngshǔi|deluge; flood
喉咙|hóulóng|throat; larynx
吼|hǒu|to roar; to howl; to shriek; roar or howl of an animal; bellow of rage
后代|hòudài|descendant; progeny; posterity; later ages; later generations
后勤|hòuqín|logistics
候选|hòuxuǎn|candidate (attributive)
忽略|hūlvè|to neglect; to overlook; to ignore
呼啸|hūxiào|to whistle; to scream; to whiz
呼吁|hūxū|to call on (sb to do sth); to appeal (to); an appeal
胡乱|húluàn|careless; reckless; casually; absent-mindedly; at will; at random; any old how
湖泊|húbó|lake
互联网|hùliánwǎng|Internet
花瓣|huābàn|petal; CL:片[pian4]
华丽|huálì|gorgeous
华侨|huáqiáo|overseas Chinese; (in a restricted sense) Chinese emigrant who still retains Chinese nationality; CL:個/个[ge4],位[wei4],名[ming2]
化肥|huàféi|fertilizer
化石|huàshí|fossil
化验|huàyàn|chemical examination; to do a lab test
化妆|huàzhuāng|to put on makeup
划分|huáfēn|to divide up; to partition; to differentiate
话筒|huàtǒng|microphone; (telephone) receiver; handset
怀孕|huáiyùn|pregnant; to have conceived; gestation; pregnancy
欢乐|huānlè|gaiety; gladness; glee; merriment; pleasure; happy; joyous; gay
还原|huányuán|to restore to the original state; to reconstruct (an event); reduction (chemistry)
环节|huánjié|(zoology) segment (of the body of a worm, centipede etc); (fig.) a part of an integrated whole: aspect (of a project), element (of a policy), sector (of the economy), stage (of a process), etc
缓和|huǎnhé|to ease (tension); to alleviate; to moderate; to allay; to make more mild
患者|huànzhě|patient; sufferer
荒凉|huāngliáng|desolate
荒谬|huāngmìu|absurd; ridiculous
荒唐|huāngtáng|beyond belief; preposterous; absurd; intemperate; dissipated
慌忙|huāngmáng|in a great rush; in a flurry
黄昏|huánghūn|dusk; evening; nightfall
