character-simplified|pinyin|definition
竖|shù|variant of 豎/竖[shu4]; to erect; vertical; vertical stroke (in Chinese characters)
束|shù|surname Shu; to bind; bunch; bundle; classifier for bunches, bundles, beams of light etc; to control
束缚|shùfú|to bind; to restrict; to tie; to commit; fetters
树立|shùlì|to set up; to establish
数额|shùé|amount; sum of money; fixed number
数目|shùmù|amount; number
耍|shuǎ|surname Shua; to play with; to wield; to act (cool etc); to display (a skill, one's temper etc)
衰老|shuāilǎo|to age; to deteriorate with age; old and weak
衰退|shuāitùi|to decline; to fall; to drop; to falter; a decline; recession (in economics)
率领|lv̀lǐng|to lead; to command; to head
涮|shuàn|to rinse; to trick; to fool sb; to cook by dipping finely sliced ingredients briefly in boiling water or soup (generally done at the dining table)
双胞胎|shuāngbāotāi|twin; CL:對/对[dui4]
爽快|shuǎngkuài|refreshed; rejuvenated; frank and straightforward
水利|shǔilì|water conservancy; irrigation works
水龙头|shǔilóngtóu|faucet; tap
水泥|shǔiní|cement; CL:袋[dai4]
司法|sīfǎ|judicial; (administration of) justice
司令|sīlìng|commanding officer
思念|sīniàn|to think of; to long for; to miss
思索|sīsuǒ|to think deeply; to ponder
思维|sīwéi|(line of) thought; thinking
思绪|sīxù|train of thought; emotional state; mood; feeling
私自|sīzì|private; personal; secretly; without explicit approval
斯文|sīwén|refined; educate; cultured; intellectual; polite; gentle
死亡|sǐwáng|to die; death
四肢|sìzhī|the four limbs of the body
肆无忌惮|sìwújìdàn|absolutely unrestrained; unbridled; without the slightest scruple
饲养|sìyǎng|to raise; to rear
耸|sǒng|to excite; to raise up; to shrug; high; lofty; towering
艘|sāo|classifier for ships; Taiwan pr. [sao1]
搜索|sōusuǒ|to search (a place); to search (a database etc)
苏醒|sūxǐng|to come to; to awaken; to regain consciousness
俗话|súhuà|common saying; proverb
塑造|sùzào|to model; to mold; (fig.) to create (a character, a market, an image etc); (literature) to portray (in words)
素食|sùshí|vegetables; vegetarian food
素质|sùzhí|inner quality; basic essence
诉讼|sùsòng|lawsuit
算了|suànle|let it be; let it pass; forget about it
算数|suànshù|to count numbers; to keep to one's word; to hold (i.e. to remain valid); to count (i.e. to be important)
随即|súijí|immediately; presently; following which
随身|súishēn|to (carry) on one's person; to (take) with one
随手|súishǒu|conveniently; without extra trouble; while doing it; in passing
随意|súiyì|as one wishes; according to one's wishes; at will; voluntary; conscious
岁月|sùiyuè|years; time
隧道|sùidào|tunnel
损坏|sǔnhuài|to damage; to injure
索赔|suǒpéi|to ask for compensation; to claim damages; claim for damages
索性|suǒxìng|you might as well (do it); simply; just
塌|tā|to collapse; to droop; to settle down
踏实|tàshí|firmly-based; steady; steadfast; to have peace of mind; free from anxiety; Taiwan pr. [ta4 shi2]
台风|táifēng|stage presence, poise; hurricane; typhoon
太空|tàikōng|outer space
泰斗|tàidǒu|leading scholar of his time; magnate
瘫痪|tānhuàn|paralysis; be paralyzed (body, transportation, etc)
贪婪|tānlán|avaricious; greedy; rapacious; insatiable; avid
贪污|tānwū|to be corrupt; corruption; to embezzle
摊儿|tānér|erhua variant of 攤/摊[tan1]
弹性|dànxìng|flexibility; elasticity
坦白|tǎnbái|honest; forthcoming; to confess
探测|tàncè|to probe; to take readings; to explore; exploration
探索|tànsuǒ|to explore; to probe
探讨|tàntǎo|to investigate; to probe
探望|tànwàng|to visit; to call on sb; to look around
叹气|tànqì|to sigh; to heave a sigh
糖葫芦|tánghúlú|sugar-coated Chinese hawthorn or other fruit on a stick; tanghulu
倘若|tǎngruò|provided that; supposing that; if
掏|tāo|to fish out (from pocket); to scoop; variant of 掏[tao1]
滔滔不绝|tāotāobùjué|unceasing torrent (idiom); talking non-stop; gabbling forty to the dozen
陶瓷|táocí|pottery and porcelain; ceramics
淘气|táoqì|naughty; mischievous
淘汰|táotài|to wash out; elimination (by selection); natural selection; to knock out (in a competition); to die out; to phase out
讨价还价|tǎojiàhuánjià|to haggle over price; to bargain
特长|tècháng|personal strength; one's special ability or strong points
特定|tèdìng|special; specific; designated; particular
特色|tèsè|characteristic; distinguishing feature or quality
提拔|tíbá|to promote to a higher job; to select for promotion
提炼|tíliàn|to extract (ore, minerals etc); to refine; to purify; to process
提示|tíshì|to point out; to remind (sb of sth); to suggest; suggestion; tip; reminder; notice
提议|tíyì|proposal; suggestion; to propose; to suggest
题材|tícái|subject matter
体谅|tǐliàng|to empathize; to allow (for sth); to show understanding; to appreciate
体面|tǐmiàn|dignity; face (as in "losing face"); honorable; creditable; (of sb's appearance) presentable; respectable
体系|tǐxì|system; setup; CL:個/个[ge4]
天才|tiāncái|talent; gift; genius; talented; gifted
天伦之乐|tiānlúnzhīlè|family love and joy; domestic bliss
天然气|tiānránqì|natural gas
天生|tiānshēng|nature; disposition; innate; natural
天堂|tiāntáng|paradise; heaven
天文|tiānwén|astronomy
田径|tiánjìng|track and field (athletics)
舔|tiǎn|to lick; to lap
挑剔|tiāotī|picky; fussy
条款|tiáokuǎn|clause (of contract or law); CL:項/项[xiang4]
条理|tiáolǐ|arrangement; order; tidiness
条约|tiáoyuē|treaty; pact; CL:個/个[ge4]
调和|diàohé|harmonious; to mediate; to reconcile; to compromise; mediation; to mix; to blend; blended; to season; seasoning; to placate
调剂|diàojì|to adjust; to balance; to make up a medical prescription
调节|diàojié|to adjust; to regulate; to harmonize; to reconcile (accountancy etc)
调解|diàojiě|to mediate; to bring parties to an agreement
调料|diàoliào|condiment; seasoning; flavoring
挑拨|tiāobō|to incite disharmony; to instigate
挑衅|tiāoxìn|to provoke; provocation
跳跃|tiàoyuè|to jump; to leap; to bound; to skip
停泊|tíngbó|to anchor; anchorage; mooring (of a ship)
停顿|tíngdùn|to halt; to break off; pause (in speech)
停滞|tíngzhì|stagnation; at a standstill; bogged down
亭子|tíngzǐ|pavilion
挺拔|tǐngbá|tall and straight
通货|tōnghuò|currency; exchange of goods
通俗|tōngsú|common; everyday; average
通用|tōngyòng|to use anywhere, anytime (card, ticket etc); to be used by everyone (language, textbook etc); (of two or more things) interchangeable
铜矿|tóngkuàng|copper mine; copper ore
同胞|tóngbāo|born of the same parents; sibling; fellow citizen; compatriot
同志|tóngzhì|comrade; (slang) homosexual; CL:個/个[ge4]
童话|tónghuà|children's fairy tales
统筹兼顾|tǒngchóujiāngù|an overall plan taking into account all factors
统计|tǒngjì|statistics; to count; to add up
统统|tǒngtǒng|totally
投机|tóujī|to speculate (on financial markets); opportunistic; congenial; agreeable
投票|tóupiào|to vote; vote
投降|tóujiàng|to surrender; surrender
投掷|tóuzhí|to throw sth a long distance; to hurl; to throw at; to throw (dice etc); to flip (a coin)
秃|tū|bald; blunt
突破|tūpò|to break through; to make a breakthrough; to surmount or break the back of (a task etc); (of ball sports) to break through a defense
图案|túàn|design; pattern
徒弟|túdì|apprentice; disciple
途径|tújìng|way; channel
涂抹|túmǒ|to paint; to smear; to apply (makeup etc); to doodle; to erase; to obliterate
土壤|tǔrǎng|soil
团结|tuánjié|to unite; unity; solidarity; united
团体|tuántǐ|group; organization; team; CL:個/个[ge4]
团圆|tuányuán|to have a reunion
推测|tūicè|speculation; to conjecture; to surmise; to speculate
推翻|tūifān|to overthrow
推理|tūilǐ|reasoning; inference; to infer; to deduce
推论|tūilùn|to infer; inference; corollary; reasoned conclusion
推销|tūixiāo|to market; to sell
吞咽|tūnyān|to swallow; to gulp
脱离|tuōlí|to separate oneself from; to break away from; diastasis (medicine); abscission; abjunction (botany)
拖延|tuōyán|to delay; to put off; to procrastinate
托运|tuōyùn|to consign (goods); to check through (baggage)
妥当|tuǒdāng|appropriate; proper; ready
妥善|tuǒshàn|appropriate; proper
妥协|tuǒxié|to compromise; to reach terms; a compromise
椭圆|tuǒyuán|oval; ellipse; elliptic
唾沫|tuòmò|spittle; saliva
挖掘|wājué|to excavate; to dig; to unearth
娃娃|wáwá|baby; small child; doll
瓦解|wǎjiě|to collapse; to disintegrate; to crumble
哇|wā|Wow!; sound of child's crying; sound of vomiting; replaces 啊[a5] when following the vowel "u" or "ao"
歪曲|wāiqū|to distort; to misrepresent
外表|wàibiǎo|external; outside; outward appearance
外行|wàixíng|layman; amateur
外界|wàijiè|the outside world; external
外向|wàixiàng|extroverted (personality); (economics etc) export-oriented
丸|wán|ball; pellet; pill
完备|wánbèi|faultless; complete; perfect; to leave nothing to be desired
完毕|wánbì|to finish; to end; to complete
玩弄|wánnòng|to play with; to toy with; to dally with; to engage in; to resort to
玩意儿|wányìér|erhua variant of 玩意[wan2 yi4]
顽固|wángù|stubborn; obstinate
顽强|wánqiáng|tenacious; hard to defeat
挽回|wǎnhúi|to retrieve; to redeem
挽救|wǎnjìu|to save; to remedy; to rescue
惋惜|wǎnxī|to regret; to feel that it is a great pity; to feel sorry for sb
万分|wànfēn|very much; extremely; one ten thousandth part
往常|wǎngcháng|usual; customary
往事|wǎngshì|past events; former happenings
网络|wǎngluò|Internet; network (computing, telecommunications, transport etc)
妄想|wàngxiǎng|to attempt vainly; a vain attempt; delusion
微不足道|wēibùzúdào|negligible; insignificant
微观|wēiguān|micro-; subatomic
威风|wēifēng|might; awe-inspiring authority; impressive
威力|wēilì|might; formidable power
威望|wēiwàng|prestige
威信|wēixìn|Weixin county in Zhaotong 昭通[Zhao1 tong1], Yunnan; prestige; reputation; trust; credit with the people
危机|wēijī|crisis; CL:個/个[ge4]
违背|wéibèi|to go against; to be contrary to; to violate
维持|wéichí|to keep; to maintain; to preserve
维生素|wéishēngsù|vitamin
维修|wéixīu|maintenance (of equipment); to protect and maintain
唯独|wéidú|only; just (i.e. it is only that...); all except; unique
为难|wèinán|to feel embarrassed or awkward; to make things difficult (for someone); to find things difficult (to do or manage)
为期|wèiqī|(to be done) by (a certain date); lasting (a certain time)
为首|wèishǒu|head; be headed by
委员|wěiyuán|committee member; committee; council; CL:個/个[ge4]
伪造|wěizào|to forge; to fake; to counterfeit
胃口|wèikǒu|appetite; liking
位于|wèiyú|to be located at; to be situated at; to lie
未免|wèimiǎn|unavoidably; can't help; really; rather
畏惧|wèijù|to fear; to dread; foreboding
卫星|wèixīng|satellite; moon; CL:顆/颗[ke1]
慰问|wèiwèn|to express sympathy, greetings, consolation etc
温带|wēndài|temperate zone
温和|wēnhé|mild; gentle; moderate; lukewarm
文凭|wénpíng|diploma
文物|wénwù|cultural relic; historical relic; CL:件[jian4],個/个[ge4]
文献|wénxiàn|document
文雅|wényǎ|elegant; refined
文艺|wényì|literature and art
问世|wènshì|to be published; to come out
窝|wō|nest; pit or hollow on the human body; lair; den; place; to harbor or shelter; to hold in check; to bend; classifier for litters and broods
乌黑|wūhēi|jet-black; dark
污蔑|wūmiè|variant of 污衊/污蔑[wu1 mie4]; to slander; to smear; to tarnish
诬陷|wúxiàn|to entrap; to frame; to plant false evidence against sb
无比|wúbǐ|incomparable; matchless
无偿|wúcháng|free; no charge; at no cost
无耻|wúchǐ|without any sense of shame; unembarrassed; shameless
无从|wúcóng|not to have access; beyond one's authority or capability; sth one has no way of doing
无动于衷|wúdòngyúzhōng|aloof; indifferent; unconcerned
无非|wúfēi|only; nothing else
无可奉告|wúkěfènggào|(idiom) "no comment"
无可奈何|wúkěnàihé|have no way out; have no alternative; abbr. to 無奈/无奈[wu2 nai4]
无赖|wúlài|hoodlum; rascal; rogue; rascally; scoundrelly
无能为力|wúnéngwèilì|impotent (idiom); powerless; helpless
无穷无尽|wúqióngwújǐn|endless; boundless; infinite
无忧无虑|wúyōuwúlv̀|carefree and without worries (idiom)
无知|wúzhī|ignorant; ignorance
舞蹈|wǔdǎo|dance (performance art); dancing
武侠|wǔxiá|martial arts chivalry (Chinese literary, theatrical and cinema genre); knight-errant
武装|wǔzhuāng|arms; equipment; to arm; military; armed (forces)
侮辱|wǔrǔ|to insult; to humiliate; dishonor
勿|wù|do not
务必|wùbì|must; to need to; to be sure to
务实|wùshí|pragmatic; dealing with concrete issues
误差|wùchà|difference; error; inaccuracy
误解|wùjiě|to misunderstand; to misread; misunderstanding
物美价廉|wùměijiàlián|good quality and cheap; a bargain
物资|wùzī|goods; supplies
溪|xī|creek; rivulet; variant of 溪[xi1]
膝盖|xīgài|knee; (Internet slang) to kneel down (in admiration)
熄灭|xímiè|to stop burning; to go out (of fire); to die out; extinguished
吸取|xīqǔ|to absorb; to draw (a lesson, insight etc); to assimilate
昔日|xīrì|formerly; in olden days
牺牲|xīshēng|to sacrifice one's life; to sacrifice (sth valued); beast slaughtered as a sacrifice
夕阳|xīyáng|sunset; the setting sun
媳妇|xífù|daughter-in-law; wife (of a younger man); young married woman; young woman
习俗|xísú|custom; tradition; local tradition; convention
袭击|xíjí|attack (esp. surprise attack); raid; to attack
喜闻乐见|xǐwénlèjiàn|to love to hear and see (idiom); well received; to one's liking
喜悦|xǐyuè|happy; joyous
系列|xìliè|series; set
细胞|xìbāo|cell (biology)
细菌|xìjūn|bacterium; germ
细致|xìzhì|delicate; fine; careful; meticulous; painstaking
霞|xiá|rose-tinted sky or clouds at sunrise or sunset
狭隘|xiáài|narrow; tight; narrow minded; lacking in experience
狭窄|xiázhǎi|narrow
峡谷|xiágǔ|canyon; gill; ravine
夏令营|xiàlìngyíng|summer camp
下属|xiàshǔ|subordinate; underling
先进|xiānjìn|advanced (technology); to advance
先前|xiānqián|before; previously
鲜明|xiānmíng|bright; clear-cut; distinct
掀起|xiānqǐ|to lift; to raise in height; to begin; upsurge; to set off (a campaign)
纤维|xiānwéi|fiber; CL:種/种[zhong3]
弦|xián|bow string; string of musical instrument; watchspring; chord (segment of curve); hypotenuse; CL:根[gen1]
嫌|xián|to dislike; suspicion; resentment; enmity; abbr. for 嫌犯[xian2 fan4], criminal suspect
嫌疑|xiányí|suspicion; to have suspicions
闲话|xiánhuà|casual conversation; chat; gossip; to talk about (whatever comes to mind)
贤惠|xiánhùi|variant of 賢慧/贤慧[xian2 hui4]
衔接|xiánjiē|to join together; to combine
显著|xiǎnzhù|outstanding; notable; remarkable; statistically significant
现场|xiàncháng|the scene (of a crime, accident etc); (on) the spot; (at) the site
现成|xiànchéng|ready-made; readily available
现状|xiànzhuàng|current situation
宪法|xiànfǎ|constitution (of a country); CL:部[bu4]
陷害|xiànhài|to entrap; to set up; to frame (up); to make false charges against
陷入|xiànrù|to sink into; to get caught up in; to land in (a predicament)
馅儿|xiànér|erhua variant of 餡/馅[xian4]
线索|xiànsuǒ|trail; clues; thread (of a story)
相差|xiāngchà|to differ; discrepancy between
相等|xiāngděng|equal; equally; equivalent
相辅相成|xiāngfǔxiāngchéng|to complement one another (idiom)
相应|xiāngyìng|to correspond; answering (one another); to agree (among the part); corresponding; relevant; appropriate; (modify) accordingly
镶嵌|xiāngqiàn|to inlay; to embed; to set (e.g. a jewel in a ring); tiling; tesselation
乡镇|xiāngzhèn|village; township
响亮|xiǎngliàng|loud and clear; resounding
响应|xiǎngyìng|to respond to; answer; CL:個/个[ge4]
巷|xiàng|lane; alley
向导|xiàngdǎo|guide
向来|xiànglái|always (previously)
向往|xiàngwǎng|to yearn for; to look forward to
消除|xiāochú|to eliminate; to remove
消毒|xiāodú|to disinfect; to sterilize
消防|xiāofáng|firefighting; fire control
消耗|xiāohào|to use up; to consume
消极|xiāojí|negative; passive; inactive
销毁|xiāohǔi|to destroy (by melting or burning); to obliterate
效益|xiàoyì|benefit; effectiveness; efficiency
肖像|xiàoxiàng|portrait (painting, photo etc); (in a general sense) representation of a person; likeness
携带|xiédài|to carry (on one's person); to support (old); Taiwan pr. [xi1 dai4]
协会|xiéhùi|an association; a society; CL:個/个[ge4],家[jia1]
协商|xiéshāng|to consult with; to talk things over; agreement
协议|xiéyì|agreement; pact; protocol; CL:項/项[xiang4]
协助|xiézhù|to provide assistance; to aid
写作|xiězuò|to write; to compose; writing; written works
屑|xiè|bits; fragments; crumbs; filings; trifling; trivial; to condescend to
谢绝|xièjué|to refuse politely
泄露|xièlù|to leak (information); to divulge; also pr. [xie4 lou4]
泄气|xièqì|to leak (gas); to be discouraged; to despair; (disparaging) pathetic; to vent one's anger; (of a tire) to be flat
新陈代谢|xīnchéndàixiè|metabolism (biology); the new replaces the old (idiom)
新郎|xīnláng|bridegroom; groom
新娘|xīnniáng|bride
新颖|xīnyǐng|lit. new bud; fig. new and original
心得|xīndé|what one has learned (through experience, reading etc); knowledge; insight; understanding; tips; CL:項/项[xiang4],個/个[ge4]
心灵|xīnlíng|bright; smart; quick-witted; heart; thoughts; spirit
心态|xīntài|attitude (of the heart); state of one's psyche; way of thinking; mentality
心疼|xīnténg|to love dearly; to feel sorry for sb; to regret; to grudge; to be distressed
心血|xīnxiě|heart's blood; expenditure (for some project); meticulous care
心眼儿|xīnyǎnér|one's thoughts; mind; intention; willingness to accept new ideas; baseless suspicions
辛勤|xīnqín|hardworking; industrious
欣慰|xīnwèi|to be gratified
欣欣向荣|xīnxīnxiàngróng|(idiom) flourishing; thriving
薪水|xīnshǔi|salary; wage
信赖|xìnlài|to trust; to have confidence in; to have faith in; to rely on
信念|xìnniàn|faith; belief; conviction
信仰|xìnyǎng|to believe in (a religion); firm belief; conviction
信誉|xìnyù|prestige; distinction; reputation; trust
腥|xīng|fishy (smell)
兴隆|xīnglóng|Xinglong county in Chengde 承德[Cheng2 de2], Hebei; prosperous; thriving; flourishing
兴旺|xīngwàng|prosperous; thriving; to prosper; to flourish
行政|xíngzhèng|administrative; executive (attributive)
形态|xíngtài|shape; form; pattern; morphology
刑事|xíngshì|criminal; penal
性感|xìnggǎn|sex appeal; eroticism; sexuality; sexy
性命|xìngmìng|life
性能|xìngnéng|function; performance
性情|xìngqíng|nature; temperament
幸好|xìnghǎo|fortunately
兴高采烈|xīnggāocǎiliè|happy and excited (idiom); in high spirits; in great delight
胸怀|xiōnghuái|one's bosom (the seat of emotions); breast; broad-minded and open; to think about; to cherish
胸膛|xiōngtáng|chest
凶恶|xiōngè|fierce; ferocious; fiendish; frightening; variant of 兇惡/凶恶, fierce; ferocious; fiendish; frightening
凶手|xiōngshǒu|murderer; assassin
雄厚|xiónghòu|robust; strong and solid
修复|xīufù|to restore; to renovate; restoration; (computing) to fix (a bug)
修建|xīujiàn|to build; to construct
修理|xīulǐ|to repair; to fix; to prune; to trim; (coll.) to sort sb out; to fix sb
羞耻|xīuchǐ|(a feeling of) shame
休养|xīuyǎng|to recuperate; to recover; to convalesce
绣|xìu|variant of 繡/绣[xiu4]; to embroider; embroidery
嗅觉|xìujué|sense of smell
虚假|xūjiǎ|false; phony; pretense
虚荣|xūróng|vanity
虚伪|xūwěi|false; hypocritical; artificial; sham
需求|xūqíu|requirement; to require; (economics) demand
须知|xūzhī|key information; instructions; it must be borne in mind
许可|xǔkě|to allow; to permit
酗酒|xùjǐu|heavy drinking; to get drunk; to drink to excess
畜牧|chùmù|to raise animals
序言|xùyán|preface; introductory remarks; preamble; prelude
宣誓|xuānshì|to swear an oath (of office); to make a vow
宣扬|xuānyáng|to proclaim; to make public or well known
悬挂|xuánguà|to suspend; to hang; (vehicle) suspension
悬念|xuánniàn|suspense in a movie, play etc; concern for sb's welfare
悬崖峭壁|xuányáqiàobì|sheer cliffs and precipitous rock faces (idiom)
旋律|xuánlv̀|melody; rhythm
旋转|xuánzhuǎn|to rotate; to revolve; to spin; to whirl
选拔|xuǎnbá|to select the best
选手|xuǎnshǒu|athlete; contestant
削弱|xuēruò|to weaken; to impair; to cripple
学历|xuélì|educational background; academic qualifications
学说|xuéshuō|theory; doctrine
学位|xuéwèi|academic degree; place in school
血压|xiěyā|blood pressure
熏陶|xūntáo|to seep in; to influence; to nurture; influence; training
循环|xúnhuán|to cycle; to circulate; circle; loop
巡逻|xúnluó|to patrol (police, army or navy)
寻觅|xúnmì|to look for
押金|yājīn|deposit; down payment
压迫|yāpò|to oppress; to repress; to constrict; oppression; stress (physics)
压岁钱|yāsùiqián|money given to children as new year present
压缩|yāsuō|to compress; compression
压抑|yāyì|to constrain or repress emotions; oppressive; stifling; depressing; repression
压榨|yāzhà|to press; to squeeze; to extract juice, oil etc by squeezing
压制|yāzhì|to suppress; to inhibit; to stifle
亚军|yàjūn|second place (in a sports contest); runner-up
烟花|yānhuā|fireworks; prostitute (esp. in Yuan theater)
淹没|yānméi|to submerge; to drown; to flood; to drown out (also fig.)
延期|yánqī|to delay; to extend; to postpone; to defer
延伸|yánshēn|to extend; to spread
延续|yánxù|to continue; to go on; to last
严寒|yánhán|bitter cold; severe winter
严禁|yánjìn|to strictly prohibit
严峻|yánjùn|grim; severe; rigorous
严厉|yánlì|severe; strict
严密|yánmì|strict; tight (organization, surveillance etc)
沿海|yánhǎi|coastal
言论|yánlùn|expression of opinion; views; remarks; arguments
炎热|yánrè|blistering hot; sizzling hot (weather)
岩石|yánshí|rock
演变|yǎnbiàn|to develop; to evolve; development; evolution
演讲|yǎnjiǎng|lecture; to make a speech
演习|yǎnxí|maneuver; exercise; practice; to maneuver
演绎|yǎnyì|(of a story etc) to unfold; to play out; to develop (a technique etc); to enact; (logic) to deduce; to infer
演奏|yǎnzòu|to perform on a musical instrument
掩盖|yǎngài|to conceal; to hide behind; to cover up
掩护|yǎnhù|to screen; to shield; to cover; protection; cover; CL:面[mian4]
掩饰|yǎnshì|to cover up; to conceal; to mask; to gloss over
眼光|yǎnguāng|gaze; insight; foresight; vision; way of looking at things
眼色|yǎnsè|signal made with one's eyes; meaningful glance
眼神|yǎnshén|expression or emotion showing in one's eyes; meaningful glance; wink; eyesight (dialect)
眼下|yǎnxià|now; at present; subocular (medicine)
验收|yànshōu|to inspect and accept; acceptance
验证|yànzhèng|to inspect and verify; experimental verification; to validate (a theory); to authenticate
厌恶|yànè|to loathe; to hate; disgusted with sth
氧气|yǎngqì|oxygen
样品|yángpǐn|sample; specimen
摇摆|yáobǎi|to sway; to wobble; to waver
摇滚|yáogǔn|rock 'n' roll (music); to rock; to fall off
摇晃|yáohuǎng|to rock; to shake; to sway
遥控|yáokòng|remote control
遥远|yáoyuǎn|distant; remote
谣言|yáoyán|rumor
要不然|yàobùrán|otherwise; or else; or
要点|yàodiǎn|main point; essential
要命|yàomìng|to cause sb's death; very; extremely; frightening; annoying
要素|yàosù|essential factor; key constituent
耀眼|yàoyǎn|to dazzle; dazzling
野蛮|yěmán|barbarous; uncivilized
野心|yěxīn|ambition; wild schemes; careerism
一流|yīlíu|top quality; front ranking
依次|yīcì|in order; in succession
依旧|yījìu|as before; still
依据|yījù|according to; basis; foundation
依靠|yīkào|to rely on sth (for support etc); to depend on
依赖|yīlài|to depend on; to be dependent on
依托|yītuō|to rely on; to depend on; support
衣裳|yīcháng|clothes
一度|yīdù|for a time; at one time; one time; once
一贯|yīguàn|consistent; constant; from start to finish; all along; persistent
一律|yīlv̀|same; uniformly; all; without exception
一目了然|yīmùlerán|obvious at a glance (idiom); obvious at a glance (idiom)
一向|yīxiàng|always (previously); a period of time in the recent past
一再|yīzài|repeatedly
遗产|yíchǎn|heritage; legacy; inheritance; bequest; CL:筆/笔[bi3]
遗传|yíchuán|heredity; to inherit (a trait); to pass on (to one's offspring)
遗留|yílíu|to leave behind; to hand down
遗失|yíshī|to lose; lost
疑惑|yíhuò|to doubt; to distrust; unconvincing; to puzzle over; misgivings; suspicions
仪器|yíqì|instrument; apparatus; CL:臺/台[tai2]
仪式|yíshì|ceremony
以便|yǐbiàn|so that; so as to; in order to
以免|yǐmiǎn|in order to avoid; so as not to
以往|yǐwǎng|in the past; formerly
以至|yǐzhì|down to; up to; to such an extent as to ...; also written 以至於/以至于[yi3 zhi4 yu2]
以致|yǐzhì|to such an extent as to; down to; up to
亦|yì|also
