character-simplified|pinyin|definition
恍然大悟|huǎngrándàwù|to suddenly realize; to suddenly see the light
挥霍|hūihuò|to squander money; extravagant; prodigal; free and easy; agile
辉煌|hūihuáng|splendid; glorious
回报|húibào|(in) return; reciprocation; payback; retaliation; to report back; to reciprocate
回避|húibì|variant of 迴避/回避[hui2 bi4]; to shun; to avoid (sb); to skirt; to evade (an issue); to step back; to withdraw; to recuse (a judge etc)
回顾|húigù|to look back; to review
回收|húishōu|to recycle; to reclaim; to retrieve; to recover; to recall (a defective product)
悔恨|hǔihèn|remorse; repentance
毁灭|hǔimiè|to perish; to ruin; to destroy
会晤|hùiwù|to meet; meeting; conference
汇报|hùibào|to report; to give an account of; to collect information and report back; to report; to give an account of; report
贿赂|hùilù|to bribe; a bribe
昏迷|hūnmí|to lose consciousness; to be in a coma; stupor; coma; stunned; disoriented
浑身|húnshēn|all over; from head to foot
混合|hùnhé|to mix; to blend; hybrid; composite
混乱|hùnluàn|confusion; chaos; disorder
混淆|hùnyáo|to obscure; to confuse; to mix up; to blur; to mislead
混浊|hùnzhuó|turbid; muddy; dirty
活该|huógāi|(coll.) serve sb right; deservedly; ought; should
活力|huólì|energy; vitality; vigor; vital force
火箭|huǒjiàn|rocket; CL:枚[mei2]
火焰|huǒyàn|blaze; flame
火药|huǒyào|gunpowder
货币|huòbì|currency; monetary; money
或许|huòxǔ|perhaps; maybe
基地|jīdì|base (of operations); industrial or military base; al-Qaeda
基金|jījīn|fund
基因|jīyīn|gene (loanword)
机动|jīdòng|locomotive; motorized; power-driven; adaptable; flexible (use, treatment, timing etc)
机构|jīgōu|mechanism; structure; organization; agency; institution; CL:所[suo3]
机关|jīguān|mechanism; gear; machine-operated; office; agency; organ; organization; establishment; institution; body; stratagem; scheme; intrigue; plot; trick; CL:個/个[ge4]
机灵|jīlíng|clever; quick-witted
机密|jīmì|secret; classified (information)
机械|jīxiè|machine; machinery; mechanical; (old) cunning; scheming
机遇|jīyù|opportunity; favorable circumstance; stroke of luck
机智|jīzhì|quick-witted; resourceful
激发|jīfā|to arouse; to excite
激励|jīlì|to encourage; to urge; motivation; incentive
激情|jīqíng|passion; fervor; enthusiasm; strong emotion
饥饿|jīè|hunger; starvation; famine
讥笑|jīxiào|to sneer
极端|jíduān|extreme
极限|jíxiàn|limit; extreme boundary
即便|jíbiàn|even if; even though; right away; immediately
即将|jíjiāng|on the eve of; to be about to; to be on the verge of
级别|jíbié|(military) rank; level; grade
疾病|jíbìng|disease; sickness; ailment
嫉妒|jídù|to be jealous; to envy; to hate
及早|jízǎo|at the earliest possible time; as soon as possible
急剧|jíjù|rapid; sudden
急切|jíqiē|eager; impatient
急躁|jízào|irritable; irascible; impetuous
籍贯|jíguàn|one's native place; place of ancestry; registered birthplace
集团|jítuán|group; bloc; corporation; conglomerate
吉祥|jíxiáng|lucky; auspicious; propitious
给予|gěiyú|to accord; to give; to show (respect)
寄托|jìtuō|to entrust (to sb); to place (one's hope, energy etc) in; a thing in which you invest (your hope, energy etc)
继承|jìchéng|to inherit; to succeed to (the throne etc); to carry on (a tradition etc)
记性|jìxìng|memory (ability to retain information)
记载|jìzài|to write down; to record; written account
季度|jìdù|quarter of a year; season (sports)
季军|jìjūn|third in a race; bronze medalist
计较|jìjiào|to bother about; to haggle; to bicker; to argue; plan; stratagem
忌讳|jìhùi|taboo; to avoid as taboo; to abstain from
寂静|jìjìng|quiet
纪要|jìyào|minutes; written summary of a meeting
技能|jìnéng|technical ability; skill
技巧|jìqiǎo|skill; technique
迹象|jīxiàng|mark; indication; sign; indicator
家常|jiācháng|the daily life of a family
家伙|jiāhuǒ|variant of 家伙[jia1 huo5]; household dish, implement or furniture; domestic animal; (coll.) guy; chap; weapon
家属|jiāshǔ|family member; (family) dependent
加工|jiāgōng|to process; processing; working (of machinery)
加剧|jiājù|to intensify; to sharpen; to accelerate; to aggravate; to exacerbate; to embitter
佳肴|jiāyáo|fine food; delicacies; delicious food
夹杂|jiāzá|to mix together (disparate substances); to mingle; a mix; to be tangled up with
假设|jiǎshè|to suppose; to presume; to assume; supposing that ...; if; hypothesis; conjecture
假使|jiǎshǐ|if; in case; suppose; given ...
坚定|jiāndìng|firm; steady; staunch; resolute
坚固|jiāngù|firm; firmly; hard; stable
坚韧|jiānrèn|tough and durable; tenacious
坚实|jiānshí|firm and substantial; solid
坚硬|jiānyìng|hard; solid
监督|jiāndū|to control; to supervise; to inspect
监视|jiānshì|to monitor; to keep a close watch over; surveillance
监狱|jiānyù|prison
尖端|jiānduān|sharp pointed end; the tip; the cusp; tip-top; most advanced and sophisticated; highest peak; the best
艰难|jiānnán|difficult; hard; challenging
兼职|jiānzhí|to hold concurrent posts; concurrent job; moonlighting
拣|jiǎn|to choose; to pick; to sort out; to pick up
剪彩|jiǎncǎi|to cut the ribbon (at a launching or opening ceremony)
检讨|jiǎntǎo|to examine or inspect; self-criticism; review
检验|jiǎnyàn|to inspect; to examine; to test
简化|jiǎnhuà|to simplify
简陋|jiǎnlòu|simple and crude
简体字|jiǎntǐzì|simplified Chinese character, as opposed to traditional Chinese character 繁體字/繁体字[fan2 ti3 zi4]
简要|jiǎnyào|concise; brief
溅|jiàn|to splash
鉴别|jiànbié|to differentiate; to distinguish
鉴定|jiàndìng|to appraise; to identify; to evaluate
鉴于|jiànyú|in view of; seeing that; considering; whereas
间谍|jiāndié|spy
间隔|jiāngé|gap; interval; compartment; to divide; to separate; to leave a gap of (two weeks, three meters etc)
间接|jiānjiē|indirect
见多识广|jiànduōshìguǎng|experienced and knowledgeable (idiom)
见解|jiànjiě|opinion; view; understanding
见闻|jiànwén|what one has seen and heard; knowledge; one's experience
健全|jiànquán|robust; sound
践踏|jiàntà|to trample
舰艇|jiàntǐng|warship; naval vessel
将近|jiāngjìn|almost; nearly; close to
将军|jiāngjūn|Chiangchun township in Tainan county 台南縣/台南县[Tai2 nan2 xian4], Taiwan; general; high-ranking military officer; to check or checkmate; fig. to embarrass; to challenge; to put sb on the spot
僵硬|jiāngyìng|stiff; rigid
桨|jiǎng|oar; paddle
奖励|jiǎnglì|to reward; reward (as encouragement)
奖赏|jiǎngshǎng|reward; prize; award
降临|jiànglín|to descend; to arrive; to come
交叉|jiāochā|to cross; to intersect; to overlap
交代|jiāodài|to hand over; to explain; to make clear; to brief (sb); to account for; to justify oneself; to confess; (coll.) to finish
交涉|jiāoshè|to negotiate (with); to have dealings (with)
交往|jiāowǎng|to associate (with); to have contact (with); to hang out (with); to date; (interpersonal) relationship; association; contact
交易|jiāoyì|(business) transaction; business deal; CL:筆/笔[bi3]
焦点|jiāodiǎn|focus; focal point
焦急|jiāojí|anxiety; anxious
娇气|jiāoqì|delicate; squeamish; finicky
角落|jiǎoluò|nook; corner
搅拌|jiǎobàn|to stir; to agitate
缴纳|jiǎonà|to pay (taxes etc)
教养|jiàoyǎng|to train; to educate; to bring up; to nurture; education; culture; upbringing; early conditioning
较量|jiàoliàng|to pit oneself against sb; to compete with sb; contest; battle; to haggle; to quibble
皆|jiē|all; each and every; in all cases
接连|jiēlián|on end; in a row; in succession
阶层|jiēcéng|hierarchy; stratum; social class
揭发|jiēfā|to expose; to bring to light; to disclose; revelation
揭露|jiēlù|to expose; to unmask; to ferret out; to disclose; disclosure
节奏|jiézòu|rhythm; tempo; musical pulse; cadence; beat
杰出|jiéchū|outstanding; distinguished; remarkable; prominent; illustrious
结晶|jiéjīng|to crystallize; crystallization; crystal; crystalline; (fig.) the fruit (of labor etc)
结局|jiéjú|conclusion; ending
结算|jiésuàn|to settle a bill; to close an account
截至|jiézhì|up to (a time); by (a time)
解除|jiěchú|to remove; to sack; to get rid of; to relieve (sb of their duties); to free; to lift (an embargo); to rescind (an agreement)
解雇|jiěgù|to fire; to sack; to dismiss; to terminate employment
解剖|jiěpōu|to dissect (an animal); to analyze; anatomy
解散|jiěsàn|to dissolve; to disband
解体|jiětǐ|to break up into components; to disintegrate; to collapse; to crumble
借鉴|jièjiàn|to draw on (others' experience); to learn from (how others do things); lesson to be learned (by observing others)
借助|jièzhù|to draw support from; with the help of
戒备|jièbèi|to take precautions; to guard against (emergency)
界限|jièxiàn|boundary
津津有味|jīnjīnyǒuwèi|with keen interest (idiom); with great pleasure; with gusto; eagerly
金融|jīnróng|banking; finance; financial
紧密|jǐnmì|inseparably close
紧迫|jǐnpò|pressing; urgent
尽快|jǐnkuài|as quickly as possible; as soon as possible; with all speed; see 儘快/尽快[jin3 kuai4]
锦绣前程|jǐnxìuqiánchéng|bright future; bright prospects
进而|jìnér|and then (what follows next)
进攻|jìngōng|to attack; to assault; to go on the offensive; attack; assault; offense (sports)
进化|jìnhuà|evolution; CL:個/个[ge4]
进展|jìnzhǎn|to make headway; to make progress
近来|jìnlái|recently; lately
近视|jìnshì|shortsighted; nearsighted; myopia
浸泡|jìnpào|to steep; to soak; to immerse
晋升|jìnshēng|to promote to a higher position
劲头|jìngtóu|enthusiasm; zeal; vigor; strength
茎|jīng|stalk; stem; CL:條/条[tiao2]
精打细算|jīngdǎxìsuàn|meticulous planning and careful accounting (idiom)
精华|jīnghuá|best feature; most important part of an object; quintessence; essence; soul
精简|jīngjiǎn|to simplify; to reduce
精密|jīngmì|accuracy; exact; precise; refined
精确|jīngquè|accurate; precise
精通|jīngtōng|to be proficient in; to master (a subject)
精心|jīngxīn|with utmost care; fine; meticulous; detailed
精致|jīngzhì|delicate; fine; exquisite; refined
经费|jīngfèi|funds; expenditure; CL:筆/笔[bi3]
经商|jīngshāng|to trade; to carry out commercial activities; in business
经纬|jīngwěi|warp and woof; longitude and latitude; main points
惊动|liángdòng|to alarm; to startle; to disturb
惊奇|liángqí|to be amazed; to be surprised; to wonder
惊讶|liángyà|amazed; astonished; to surprise; amazing; astonishment; awe
兢兢业业|jīngjīngyèyè|cautious and conscientious
井|jǐng|Jing, one of the 28 constellations of Chinese astronomy; surname Jing; a well; CL:口[kou3]; neat; orderly
警告|jǐnggào|to warn; to admonish
警惕|jǐngtì|to be on the alert; vigilant; alert; on guard; to warn
颈椎|jǐngzhūi|cervical vertebra; the seven cervical vertebrae in the neck of humans and most mammals
敬礼|jìnglǐ|to salute; salute
境界|jìngjiè|boundary; state; realm
竞赛|jìngsài|race; competition; CL:個/个[ge4]
竞选|jìngxuǎn|to take part in an election; to run for office
镜头|jìngtóu|camera lens; camera shot (in a movie etc); scene
纠纷|jīufēn|dispute
纠正|jīuzhèng|to correct; to make right
酒精|jǐujīng|alcohol; ethanol CH3CH2OH; ethyl alcohol; also written 乙醇; grain alcohol
救济|jìujì|emergency relief; to help the needy with cash or goods
就近|jìujìn|nearby; in a close neighborhood
就业|jìuyè|to get a job; employment
就职|jìuzhí|to take office; to assume a post
鞠躬|jūgōng|to bow; (literary) to bend down
拘留|jūlíu|to detain (a prisoner); to keep sb in custody
拘束|jūshù|to restrict; to restrain; constrained; awkward; ill at ease; uncomfortable; reticent
居住|jūzhù|to reside; to dwell; to live in a place; resident in
局部|júbù|part; local
局面|júmiàn|aspect; phase; situation
局势|júshì|situation; state (of affairs)
局限|júxiàn|variant of 局限[ju2 xian4]; to limit; to confine; to restrict sth within set boundaries
举动|jǔdòng|act; action; activity; move; movement
举世闻名|jǔshìwénmíng|world-famous (idiom)
举世瞩目|jǔshìzhǔmù|to receive worldwide attention
举足轻重|jǔzúqīngzhòng|to play a critical role (idiom); influential
咀嚼|jǔjiáo|to chew; to think over
沮丧|jūsāng|dispirited; dejected; dismayed
剧本|jùběn|script for play, opera, movie etc; screenplay; scenario
剧烈|jùliè|violent; acute; severe; fierce
聚精会神|jùjīnghùishén|to concentrate one's attention (idiom)
据悉|jùxī|according to reports; it is reported (that)
决策|juécè|strategic decision; decision-making; policy decision; to determine policy
觉悟|juéwù|to come to understand; to realize; consciousness; awareness; Buddhist enlightenment (Sanskrit: cittotpāda)
觉醒|juéxǐng|to awaken; to come to realize; awakened to the truth; the truth dawns upon one; scales fall from the eyes; to become aware
绝望|juéwàng|to despair; to give up all hope; desperate; desperation
军队|jūndùi|army; troops; CL:支[zhi1],個/个[ge4]
卡通|qiǎtōng|cartoon (loanword)
开采|kāicǎi|to extract (ore or other resource from a mine); to exploit; to mine
开除|kāichú|to expel (a member of an organization); to fire (an employee)
开阔|kāikuò|wide; open (spaces); to open up
开朗|kāilǎng|spacious and well-lit; open and clear; (of character) optimistic; cheerful; carefree
开明|kāimíng|enlightened; open-minded; enlightenment
开辟|kāipì|to open up; to set up; to establish
开水|kāishǔi|boiled water; boiling water
开拓|kāituò|to break new ground (for agriculture); to open up (a new seam); to develop (border regions); fig. to open up (new horizons)
开展|kāizhǎn|to launch; to develop; to unfold; (of an exhibition etc) to open
开支|kāizhī|expenditures; expenses; CL:筆/笔[bi3], 項/项[xiang4]; to spend money; (coll.) to pay wages
刊登|kāndēng|to carry a story; to publish (in a newspaper or magazine)
刊物|kānwù|publication
勘探|kāntàn|to explore; to survey; to prospect (for oil etc); prospecting
看待|kàndài|to look upon; to regard
看望|kànwàng|to visit; to pay a call to
慷慨|kāngkǎi|vehement; fervent; generous; giving; liberal
扛|káng|to raise aloft with both hands; (of two or more people) to carry sth together; to carry on one's shoulder; (fig.) to take on (a burden, duty etc); old variant of 扛[gang1]
考察|kǎochá|to inspect; to observe and study; on-the-spot investigation
考古|kǎogǔ|archaeology
考核|kǎohé|to examine; to check up on; to assess; to review; appraisal; review; evaluation
考验|kǎoyàn|to test; to put to the test; trial; ordeal
靠拢|kàolǒng|to draw close to
磕|kē|to tap; to knock (against sth hard); to knock (mud from boots, ashes from a pipe etc); variant of 嗑[ke4]
颗粒|kēlì|kernel; granule; granulated (sugar, chemical product)
科目|kēmù|subject
渴望|kěwàng|to thirst for; to long for
可观|kěguān|considerable; impressive; significant
可口|kěkǒu|tasty; to taste good
可恶|kěè|repulsive; vile; hateful; abominable
可笑|kěxiào|funny; ridiculous
可行|kěxíng|feasible
刻不容缓|kèbùrónghuǎn|to brook no delay; to demand immediate action
课题|kètí|task; problem; issue
客户|kèhù|client; customer
啃|kěn|to gnaw; to nibble; to bite
恳切|kěnqiē|earnest; sincere
坑|kēng|hole; pit; tunnel; to defraud; variant of 坑[keng1]; pit; hole
空洞|kōngdòng|cavity; empty; vacuous
空前绝后|kōngqiánjuéhòu|unprecedented and never to be duplicated; the first and the last; unmatched; unique
空想|kōngxiǎng|daydream; fantasy; to fantasize
空虚|kōngxū|hollow; emptiness; meaningless
孔|kǒng|surname Kong; hole; CL:個/个[ge4]; classifier for cave dwellings
恐吓|kǒngxià|to threaten; to menace
恐惧|kǒngjù|to be frightened; fear; dread
空白|kōngbái|blank space
空隙|kōngxì|crack; gap between two objects; gap in time between two events
口气|kǒuqì|tone of voice; the way one speaks; manner of expression; tone
口腔|kǒuqiāng|oral cavity
口头|kǒutóu|oral; verbal
口音|kǒuyīn|oral speech sounds (linguistics); voice; accent
枯竭|kūjié|used up; dried up; exhausted (of resources)
枯燥|kūzào|dry and dull; uninteresting; dry-as-dust
挎|kū|to carry (esp. slung over the arm, shoulder or side)
跨|kuà|to step across; to stride over; to straddle; to span
快活|kuàihuó|happy; cheerful
宽敞|kuānchǎng|spacious; wide
款待|kuǎndài|to entertain; to be hospitable to
款式|kuǎnshì|pattern; style; design; CL:種/种[zhong3]; elegant; elegance; good taste
筐|kuāng|basket; CL:隻/只[zhi1]
旷课|kuàngkè|to play truant; to cut classes
框架|kuàngjià|frame; framework; fig. pattern; outline; organizing plan
况且|kuàngqiě|moreover; besides; in addition; furthermore
亏待|yúdài|to treat sb unfairly
亏损|yúsǔn|deficit; (financial) loss
昆虫|kūnchóng|insect; CL:隻/只[zhi1],群[qun2],堆[dui1]
捆绑|kǔnbǎng|to bind
扩充|kuòchōng|to expand
扩散|kuòsàn|to spread; to proliferate; to diffuse; spread; proliferation; diffusion
扩张|kuòzhāng|expansion; dilation; to expand (e.g. one's power or influence); to broaden
喇叭|lǎbā|horn (automobile etc); loudspeaker; brass wind instrument; trumpet; suona 鎖吶/锁呐[suo3 na4]
啦|la|(onom.) sound of singing, cheering etc; (phonetic); (dialect) to chat; sentence-final particle, contraction of 了啊, indicating exclamation; particle placed after each item in a list of examples
来历|láilì|history; antecedents; origin
来源|láiyuán|source (of information etc); origin
栏目|lánmù|regular column or segment (in a publication or broadcast program); program (TV or radio)
懒惰|lǎnduò|idle; lazy
狼狈|lángbèi|in a difficult situation; to cut a sorry figure; scoundrel! (derog.)
朗读|lǎngdú|to read aloud
捞|lāo|to fish up; to dredge up
唠叨|láotāo|to prattle; to chatter away; to nag; garrulous; nagging
牢固|láogù|firm; secure
牢骚|láosāo|discontent; complaint; to complain
乐趣|lèqù|delight; pleasure; joy
乐意|lèyì|to be willing to do sth; to be ready to do sth; to be happy to do sth; content; satisfied
雷达|léidá|radar (loanword)
类似|lèisì|similar; analogous
冷淡|lěngdàn|cold; indifferent
冷酷|lěngkù|grim; unfeeling; callous
冷却|lěngquè|to cool off; cooling
愣|lèng|to look distracted; to stare blankly; distracted; blank; (coll.) unexpectedly; rash; rashly
黎明|límíng|dawn; daybreak
里程碑|lǐchéngbēi|milestone
礼节|lǐjié|etiquette
理睬|lǐcǎi|to heed; to pay attention to
理智|lǐzhì|reason; intellect; rationality; rational
立场|lìcháng|position; standpoint; CL:個/个[ge4]
立交桥|lìjiāoqiáo|overpass; flyover
立体|lìtǐ|three-dimensional; solid; stereoscopic
立足|lìzú|to stand; to have a footing; to be established; to base oneself on
历代|lìdài|successive generations; successive dynasties; past dynasties
历来|lìlái|always; throughout (a period of time); (of) all-time
利害|lìhài|pros and cons; advantages and disadvantages; gains and losses; terrible; formidable; serious; devastating; tough; capable; sharp; severe; fierce
利率|lìlv̀|interest rates
力图|lìtú|to try hard to; to strive to
力争|lìzhēng|to work hard for; to do all one can; to contend strongly
例外|lìwài|exception; to be an exception
连年|liánnián|successive years; over many years
连锁|liánsuǒ|to interlock; to be linked; chain (store etc)
连同|liántóng|together with; along with
联欢|liánhuān|to have a get-together; celebration; party
联络|liánluò|to get in touch with; to contact; to stay in contact (with); liaison; (math.) connection
联盟|liánméng|alliance; union; coalition
联想|liánxiǎng|abbr. for 聯想集團/联想集团[Lian2 xiang3 Ji2 tuan2]; to associate (cognitively); to make an associative connection; mental association; word prediction and auto-complete functions of input method editing programs
廉洁|liánjié|honest; not coercive; honesty; integrity; incorruptible
良心|liángxīn|conscience
晾|liàng|to dry in the air; (fig.) to cold-shoulder
谅解|liàngjiě|to understand; to make allowances for; understanding
辽阔|liáokuò|vast; extensive
列举|lièjǔ|a list; to list; to enumerate
淋|lín|to sprinkle; to drip; to pour; to drench; to filter; to strain; to drain; gonorrhea; (TCM) strangury
临床|línchuáng|clinical
吝啬|lìnsè|stingy; mean; miserly
零星|língxīng|fragmentary; random; bits and pieces; sporadic
凌晨|língchén|very early in the morning; in the wee hours
灵感|línggǎn|inspiration; insight; a burst of creativity in scientific or artistic endeavor
灵魂|línghún|soul; spirit
灵敏|língmǐn|smart; clever; sensitive; keen; quick; sharp
伶俐|línglì|clever; witty; intelligent
领会|lǐnghùi|to understand; to comprehend; to grasp
领事馆|lǐngshìguǎn|consulate
领土|lǐngtǔ|territory
领悟|lǐngwù|to understand; to comprehend
领先|lǐngxiān|to lead; to be in front
领袖|lǐngxìu|leader; CL:個/个[ge4],位[wei4],名[ming2]
溜|līu|to slip away; to escape in stealth; to skate
留恋|líuliàn|reluctant to leave; to hate to have to go; to recall fondly
留念|líuniàn|to keep as a souvenir; to recall fondly
留神|líushén|to take care; to be careful
流浪|líulàng|to drift about; to wander; to roam; nomadic; homeless; unsettled (e.g. population); vagrant
流露|líulù|to reveal (indirectly, implicitly); to show (interest, contempt etc) by means of one's actions, tone of voice etc
流氓|líumáng|rogue; hoodlum; gangster; immoral behavior
流通|líutōng|to circulate; to distribute; circulation; distribution
聋哑|lóngyǎ|deaf and dumb
隆重|lóngzhòng|grand; prosperous; ceremonious; solemn
垄断|lǒngduàn|to enjoy market dominance; to monopolize
笼罩|lóngzhào|to envelop; to shroud
搂|lǒu|to draw towards oneself; to gather; to gather up (one's gown, sleeves etc); to grab (money); to extort; to hug; to embrace; to hold in one's arms
炉灶|lúzào|stove
轮船|lúnchuán|steamship; steamer; ocean liner; ship; CL:艘[sou1]
轮廓|lúnkuò|an outline; silhouette
轮胎|lúntāi|tire; pneumatic tire
论坛|lùntán|forum (for discussion)
论证|lùnzhèng|to prove a point; to expound on; to demonstrate or prove (through argument); proof
啰唆|luōsuō|variant of 囉嗦/啰嗦[luo1 suo5]
螺丝钉|luósīdīng|screw
落成|luòchéng|to complete a construction project
落实|luòshí|practical; workable; to implement; to carry out; to decide
屡次|lv̌cì|repeatedly; time and again
履行|lv̌xíng|to fulfill (one's obligations); to carry out (a task); to implement (an agreement); to perform
掠夺|lvèduó|to plunder; to rob
略微|lvèwēi|a little bit; slightly
麻痹|mábì|paralysis; palsy; numbness; to benumb; (fig.) to lull; negligent; apathetic
麻木|mámù|numb; insensitive; apathetic
麻醉|mázùi|anesthesia; (fig.) to poison (sb's mind)
码头|mǎtóu|dock; pier; wharf; CL:個/个[ge4]
嘛|ma|modal particle indicating that sth is obvious; particle indicating a pause for emphasis
埋伏|máifú|to ambush; to lie in wait for; to lie low; ambush
埋没|máiméi|to engulf; to bury; to overlook; to stifle; to neglect; to fall into oblivion
埋葬|máizàng|to bury
迈|mài|to take a step; to stride
脉搏|màibó|pulse (both medical and figurative)
埋怨|máiyuàn|to complain; to grumble (about); to reproach; to blame
慢性|mànxìng|slow and patient; chronic (disease); slow to take effect (e.g. a slow poison)
漫长|màncháng|very long; endless
漫画|mànhuà|caricature; cartoon; Japanese manga
蔓延|mànyán|to extend; to spread
忙碌|mánglù|busy; bustling
茫茫|mángmáng|boundless; vast and obscure
茫然|mángrán|blankly; vacantly; at a loss
盲目|mángmù|blind; blindly; ignorant; lacking understanding
冒充|màochōng|to feign; to pretend to be; to pass oneself off as
茂盛|màoshèng|lush
枚|méi|surname Mei; classifier for coins, rings, badges, pearls, sporting medals, rockets, satellites etc; tree trunk; whip; wooden peg, used as a gag for marching soldiers (old)
没辙|méichè|at one's wit's end; unable to find a way out
媒介|méijiè|intermediary; vehicle; vector; medium; media
媒体|méitǐ|media, esp. news media
美观|měiguān|pleasing to the eye; beautiful; artistic
美满|měimǎn|happy; blissful
美妙|měimiào|beautiful; wonderful; splendid
门诊|ménzhěn|outpatient service
蒙|méng|drizzle; mist; to deceive; to cheat; to hoodwink; to make a wild guess; blind; dim-sighted; surname Meng; Mongol ethnic group; abbr. for Mongolia 蒙古國/蒙古国[Meng3 gu3 guo2]; Taiwan pr. [Meng2]; (knocked) unconscious; dazed; stunned; to cover; ignorant; to suffer (misfortune); to receive (a favor); to cheat
萌芽|méngyá|to sprout (lit. or fig.); to bud; to germinate; germ; seed; bud
猛烈|měngliè|fierce; violent (criticism etc)
梦想|mèngxiǎng|(fig.) to dream of; dream
眯|mǐ|to blind (as with dust); Taiwan pr. [mi3]; to narrow one's eyes; to squint; (dialect) to take a nap
弥补|míbǔ|to complement; to make up for a deficiency
弥漫|mímàn|to pervade; to fill the air; diffuse; everywhere present; about to inundate (water); permeated by (smoke); filled with (dust); to saturate (the air with fog, smoke etc); variant of 彌漫/弥漫[mi2 man4]
迷惑|míhuò|to puzzle; to confuse; to baffle
迷人|mírén|fascinating; enchanting; charming; tempting
迷失|míshī|to lose (one's bearings); to get lost
迷信|míxìn|superstition; to have a superstitious belief (in sth)
密度|mìdù|density; thickness
密封|mìfēng|to seal up
